subsidiary_name,subsidiary_id,Bezeichnung,Lieferant,Kategorie (CPV Hauptteil),Bieter,Summe,Aktualisiert
ÖBB-Technische Services-Gesellschaft (2),37657,Lieferung von Dacharbeitsbühnen für die ÖBB Technische Services GmbH,,44212317 Gerüstkonstruktionen,,,06.03.2024
ÖBB-Technische Services-Gesellschaft (2),37657,Lieferung und Montage einer Dacharbeitsbühne Wien Simmering,Klik Bühnensysteme GesmbH,44212317 Gerüstkonstruktionen,1,"3.226.600,00",01.03.2024
ÖBB-Technische Services-Gesellschaft (2),37657,"Modifikation der bestehenden Prüfanlage für Fahrmotoren, ÖBB-TS, Linz",,31682210 Messgeräte und Steuer- und Überwachungsanlagen,,,26.02.2024
ÖBB-Technische Services-Gesellschaft (2),37657,CNC Drehmaschine,,42621100 CNC-Drehmaschine,,,19.02.2024
ÖBB-Technische Services-Gesellschaft (2),37657,Fahrmotorwasch- und Vakuumtrockenanlage TS Linz,,42716100 Waschanlagen,,,12.02.2024
